{
  "metadata": {
    "instance_name": "instance_02_basic_medium",
    "size_category": "medium",
    "scenario_type": "basic",
    "schema_version": "1.0.0",
    "random_seed": 1002,
    "units": {
      "distance": "abstract",
      "energy": "abstract",
      "weight": "abstract"
    },
    "active_features": {
      "terrain_enabled": true,
      "fleet_size_limited": false,
      "collision_avoidance": false,
      "explicit_nfz_enabled": false
    },
    "grid_bounds": {
      "x_size": 100,
      "y_size": 100,
      "z_size": 30
    },
    "counts": {
      "customers": 30,
      "no_fly_zones": 0
    }
  },
  "drone_profile": {
    "payload_capacity": 25,
    "battery_capacity": 500.0,
    "fleet_size": null
  },
  "energy_costs": {
    "horizontal_rate": 1.0,
    "vertical_ascend_multiplier": 1.5,
    "vertical_descend_multiplier": 1.0,
    "hover_rate": 0.0
  },
  "pathfinding": {
    "enabled": true,
    "algorithm": "safe_altitude_grid",
    "connectivity": 26,
    "clearance": 0,
    "diagonal_cost": "euclidean",
    "cache_edge_paths": false,
    "cost_model": "energy_costs_v1"
  },
  "travel_matrix_node_ids": [
    0,
    1,
    2,
    3,
    4,
    5,
    6,
    7,
    8,
    9,
    10,
    11,
    12,
    13,
    14,
    15,
    16,
    17,
    18,
    19,
    20,
    21,
    22,
    23,
    24,
    25,
    26,
    27,
    28,
    29,
    30
  ],
  "travel_cost_matrix": [
    [
      0.0,
      85.0956,
      50.6773,
      65.3845,
      14.2127,
      75.4626,
      63.8289,
      65.7805,
      67.2099,
      86.8015,
      31.7924,
      59.1725,
      42.0595,
      69.4093,
      89.1725,
      73.4166,
      22.1155,
      81.2443,
      84.6198,
      80.793,
      88.9245,
      79.7545,
      35.28,
      32.6228,
      32.5,
      61.7033,
      89.6443,
      64.4591,
      83.0999,
      9.2462,
      66.4966
    ],
    [
      86.5956,
      0.0,
      118.4294,
      113.506,
      97.2235,
      113.6038,
      120.6388,
      81.3019,
      98.937,
      67.9279,
      117.6332,
      92.5364,
      51.7066,
      64.9951,
      80.0933,
      107.9098,
      71.073,
      87.9296,
      127.9639,
      61.9722,
      63.5868,
      89.2122,
      121.4177,
      58.8848,
      66.7083,
      123.8085,
      73.5588,
      113.7772,
      2.0,
      79.8192,
      91.0862
    ],
    [
      47.6773,
      113.9294,
      0.0,
      32.2308,
      47.8688,
      66.8905,
      29.1655,
      54.6488,
      67.1193,
      103.7718,
      41.28,
      37.3766,
      82.4199,
      70.0078,
      121.2133,
      68.7791,
      57.6118,
      110.7268,
      36.3607,
      101.06,
      101.3716,
      108.4523,
      59.4138,
      93.9104,
      59.4123,
      69.593,
      122.2549,
      46.2753,
      111.9759,
      56.6488,
      91.8025
    ],
    [
      60.8845,
      107.506,
      30.7308,
      0.0,
      67.9406,
      92.2844,
      19.105,
      61.2185,
      89.3481,
      87.9685,
      80.5803,
      36.0,
      81.0069,
      67.1378,
      126.103,
      92.955,
      59.8556,
      119.6187,
      32.061,
      88.2308,
      108.4124,
      118.1231,
      79.9437,
      74.8999,
      78.9466,
      97.0484,
      124.8925,
      84.5082,
      105.8019,
      67.6888,
      103.8155
    ],
    [
      14.2127,
      95.7235,
      50.8688,
      72.4406,
      0.0,
      62.0832,
      66.1972,
      47.1508,
      56.4591,
      100.7083,
      21.0278,
      40.4833,
      89.5619,
      83.2701,
      89.9464,
      61.0644,
      36.1554,
      77.9674,
      86.8201,
      94.4054,
      94.6941,
      75.5982,
      25.0907,
      80.2945,
      24.1433,
      70.2492,
      92.5847,
      16.5602,
      93.7853,
      55.2354,
      59.1548
    ],
    [
      73.9626,
      110.6038,
      68.3905,
      95.2844,
      60.5832,
      0.0,
      84.9605,
      104.7396,
      37.6529,
      122.586,
      65.1228,
      68.4685,
      108.3332,
      105.5,
      86.5351,
      9.3246,
      91.934,
      68.6096,
      99.5349,
      115.5412,
      100.4638,
      64.7099,
      67.5147,
      100.1222,
      48.1716,
      37.7066,
      93.1498,
      58.2099,
      108.952,
      76.9863,
      48.8452
    ],
    [
      59.3289,
      114.6388,
      27.6655,
      19.105,
      61.6972,
      81.9605,
      0.0,
      59.1566,
      81.721,
      100.5062,
      68.8847,
      42.6931,
      89.5233,
      76.2681,
      125.9751,
      83.712,
      65.5847,
      116.5816,
      20.8137,
      99.0242,
      111.8725,
      114.5052,
      67.0793,
      81.7844,
      73.3397,
      84.7527,
      126.3094,
      61.2892,
      112.7553,
      67.8014,
      98.3352
    ],
    [
      65.2805,
      79.3019,
      57.1488,
      65.2185,
      46.6508,
      105.7396,
      63.1566,
      0.0,
      96.6231,
      61.6548,
      92.3659,
      17.7788,
      32.3847,
      18.4929,
      104.7357,
      103.4466,
      16.2788,
      103.3354,
      81.708,
      59.9764,
      62.803,
      102.937,
      94.6378,
      59.9951,
      61.5428,
      91.8836,
      101.5,
      92.3507,
      77.7311,
      65.9006,
      93.8758
    ],
    [
      64.2099,
      94.437,
      67.1193,
      90.8481,
      53.4591,
      36.1529,
      83.221,
      94.1231,
      0.0,
      108.7616,
      65.2353,
      88.0078,
      93.3573,
      92.242,
      69.0,
      29.0623,
      79.7814,
      51.4429,
      98.4707,
      101.452,
      82.9732,
      47.7099,
      68.6232,
      85.8218,
      34.6015,
      25.6982,
      75.4975,
      57.8329,
      92.8905,
      64.9473,
      31.198
    ],
    [
      86.3015,
      65.9279,
      106.2718,
      91.9685,
      100.2083,
      123.586,
      104.5062,
      61.6548,
      111.2616,
      0.0,
      117.2775,
      76.8982,
      20.105,
      51.9391,
      102.5286,
      119.522,
      32.2025,
      107.6298,
      109.959,
      42.044,
      54.469,
      83.348,
      120.2257,
      59.5599,
      76.8025,
      110.8904,
      64.0714,
      115.7122,
      65.6548,
      82.5833,
      105.4415
    ],
    [
      33.2924,
      117.6332,
      45.78,
      86.5803,
      22.5278,
      68.1228,
      74.8847,
      94.3659,
      69.7353,
      119.2775,
      0.0,
      50.7666,
      110.3378,
      102.1498,
      111.1154,
      70.2771,
      87.2647,
      97.2454,
      81.9243,
      113.7428,
      117.1551,
      94.3218,
      4.1231,
      100.907,
      42.8869,
      71.5,
      114.5,
      7.9031,
      115.6642,
      76.4026,
      76.5119
    ],
    [
      58.1725,
      90.0364,
      39.3766,
      39.5,
      39.4833,
      68.9685,
      46.1931,
      17.2788,
      90.0078,
      76.3982,
      48.2666,
      0.0,
      46.9222,
      33.5753,
      108.1038,
      72.969,
      24.0217,
      103.0945,
      65.5412,
      74.0476,
      72.4262,
      102.0,
      49.8219,
      69.6742,
      55.5882,
      81.344,
      106.5185,
      49.618,
      88.2259,
      63.0832,
      89.6498
    ],
    [
      42.0595,
      50.2066,
      85.4199,
      85.5069,
      89.5619,
      109.8332,
      94.0233,
      32.8847,
      96.3573,
      20.605,
      108.8378,
      47.9222,
      0.0,
      13.8924,
      85.0,
      105.0067,
      25.5,
      90.2409,
      113.4434,
      11.0454,
      35.2053,
      66.0833,
      112.3303,
      46.4403,
      62.6725,
      119.9389,
      44.2832,
      105.942,
      49.1803,
      36.3412,
      89.6406
    ],
    [
      69.4093,
      63.4951,
      73.0078,
      71.6378,
      83.2701,
      107.0,
      80.7681,
      18.9929,
      95.242,
      52.4391,
      100.6498,
      34.5753,
      13.8924,
      0.0,
      93.2284,
      103.2462,
      15.3924,
      95.1269,
      99.922,
      46.7047,
      46.1774,
      95.3817,
      103.7419,
      46.198,
      60.5,
      94.1833,
      88.7587,
      98.8547,
      62.0416,
      65.7321,
      90.1664
    ],
    [
      88.6725,
      78.0933,
      123.7133,
      130.103,
      89.4464,
      87.5351,
      129.9751,
      104.7357,
      71.5,
      102.5286,
      109.1154,
      108.6038,
      84.5,
      92.7284,
      0.0,
      79.6566,
      88.8649,
      19.7631,
      138.2776,
      95.5081,
      54.6246,
      24.4249,
      113.1942,
      83.5306,
      70.5595,
      96.1018,
      9.6023,
      102.5671,
      77.8038,
      82.6664,
      62.5588
    ],
    [
      70.9166,
      103.9098,
      69.2791,
      94.955,
      58.5644,
      8.3246,
      85.712,
      101.4466,
      29.5623,
      117.522,
      66.2771,
      71.469,
      102.5067,
      100.7462,
      77.6566,
      0.0,
      87.7699,
      59.5143,
      100.5777,
      110.301,
      92.4062,
      55.5624,
      69.0876,
      94.7193,
      42.7485,
      16.7631,
      84.5701,
      59.0466,
      102.3401,
      72.7832,
      40.5278
    ],
    [
      21.6155,
      69.073,
      60.1118,
      63.8556,
      35.6554,
      92.934,
      69.5847,
      16.2788,
      82.2814,
      32.2025,
      85.2647,
      24.5217,
      25.0,
      14.8924,
      88.8649,
      89.7699,
      0.0,
      87.0685,
      89.5294,
      26.4951,
      48.669,
      86.7189,
      88.3941,
      16.3178,
      47.2311,
      79.8173,
      86.1972,
      83.5104,
      67.1757,
      51.5,
      78.51
    ],
    [
      79.7443,
      84.9296,
      112.2268,
      122.6187,
      76.4674,
      68.6096,
      119.5816,
      102.3354,
      52.9429,
      106.6298,
      94.2454,
      102.5945,
      88.7409,
      93.6269,
      18.7631,
      60.5143,
      86.0685,
      0.0,
      127.8435,
      99.1586,
      65.4706,
      4.6623,
      98.1607,
      84.8385,
      55.5,
      76.6566,
      54.6868,
      87.2083,
      84.0668,
      75.5114,
      44.8132
    ],
    [
      78.6198,
      120.4639,
      33.3607,
      30.561,